{"schema_version":"1.0.0","run_id":"synthetic-all-variants","crate":"core","functions":[{"name":"<! as fmt::Debug>::fmt","status":"skipped","category":"missing_arbitrary","detail":"Missing Arbitrary implementation for argument(s) self: !","args":[{"name":"self","type":"!"}]},{"name":"array::from_fn_checked","status":"skipped","category":"const_generic_unsupported","detail":"Generic Function: the function has a `const {}` block that may constrain its const generic parameter(s), and the value autoharness substitutes (2) is not guaranteed to satisfy it"},{"name":"core_arch::x86::sse2::_mm_slli_epi16","status":"skipped","category":"const_generic_unsupported","detail":"Generic Function: non-usize const generic parameters are not supported yet"},{"name":"fmt::Formatter::pad","status":"skipped","category":"missing_arbitrary","detail":"Missing Arbitrary implementation for argument(s) self: &mut fmt::Formatter<'_>, s: &str","args":[{"name":"self","type":"&mut fmt::Formatter<'_>"},{"name":"s","type":"&str"}]},{"name":"intrinsics::ctpop","status":"skipped","category":"no_body","detail":"The function does not have a body"},{"name":"iter::zip","status":"skipped","category":"missing_arbitrary","detail":"Missing Arbitrary implementation for argument(s) a: collections::HashMap<K, V>, f: impl Fn(u8, u8) -> (u8, u8)","args":[{"name":"a","type":"collections::HashMap<K, V>"},{"name":"f","type":"impl Fn(u8, u8) -> (u8, u8)"}]},{"name":"num::<impl u8>::checked_add","status":"generated"},{"name":"ptr::alignment::Alignment::new","status":"generated"},{"name":"slice::sort::merge","status":"skipped","category":"generic_no_candidate","detail":"Generic Function: no candidate type (i32, u32, usize, u8, i64, u64, f64, f32, bool, char) satisfies the function's trait bounds"},{"name":"str::from_utf8","status":"skipped","category":"requires_bounded_arguments","detail":"Requires --bounded-arguments for argument(s) v: &[u8]","args":[{"name":"v","type":"&[u8]"}]}]}
