{"schema_version":"1.0.0","run_id":"synthetic-all-variants","crate":"alloc","functions":[{"name":"alloc::Global::allocate","status":"generated"},{"name":"vec::Vec::<T, A>::push","status":"skipped","category":"generic_no_candidate","detail":"Generic Function: no candidate type (i32, u32, usize, u8, i64, u64, f64, f32, bool, char and 3 types implementing the required traits) satisfies the function's trait bounds"}]}
