{"schema_version":"1.0.0","run_id":"baseline-2026-09-17-x86_64","crate":"rustc_literal_escaper","functions":[{"name":"<EscapeError as rustc_std_workspace_core::cmp::Eq>::assert_fields_are_eq","status":"generated"},{"name":"<EscapeError as rustc_std_workspace_core::cmp::PartialEq>::eq","status":"generated"},{"name":"<EscapeError as rustc_std_workspace_core::fmt::Debug>::fmt","status":"generated"},{"name":"<MixedUnit as rustc_std_workspace_core::clone::Clone>::clone","status":"skipped","category":"missing_arbitrary","detail":"Missing Arbitrary implementation for argument(s) self: &MixedUnit","args":[{"name":"self","type":"&MixedUnit"}]},{"name":"<MixedUnit as rustc_std_workspace_core::cmp::Eq>::assert_fields_are_eq","status":"skipped","category":"missing_arbitrary","detail":"Missing Arbitrary implementation for argument(s) self: &MixedUnit","args":[{"name":"self","type":"&MixedUnit"}]},{"name":"<MixedUnit as rustc_std_workspace_core::cmp::PartialEq>::eq","status":"skipped","category":"missing_arbitrary","detail":"Missing Arbitrary implementation for argument(s) self: &MixedUnit, other: &MixedUnit","args":[{"name":"self","type":"&MixedUnit"},{"name":"other","type":"&MixedUnit"}]},{"name":"<MixedUnit as rustc_std_workspace_core::convert::From<rustc_std_workspace_core::num::NonZero<char>>>::from","status":"skipped","category":"missing_arbitrary","detail":"Missing Arbitrary implementation for argument(s) c: rustc_std_workspace_core::num::NonZero<char>","args":[{"name":"c","type":"rustc_std_workspace_core::num::NonZero<char>"}]},{"name":"<MixedUnit as rustc_std_workspace_core::convert::From<rustc_std_workspace_core::num::NonZero<u8>>>::from","status":"generated"},{"name":"<MixedUnit as rustc_std_workspace_core::convert::TryFrom<char>>::try_from","status":"generated"},{"name":"<MixedUnit as rustc_std_workspace_core::convert::TryFrom<u8>>::try_from","status":"generated"},{"name":"<MixedUnit as rustc_std_workspace_core::fmt::Debug>::fmt","status":"skipped","category":"missing_arbitrary","detail":"Missing Arbitrary implementation for argument(s) self: MixedUnit","args":[{"name":"self","type":"MixedUnit"}]},{"name":"<Mode as rustc_std_workspace_core::clone::Clone>::clone","status":"generated"},{"name":"<Mode as rustc_std_workspace_core::cmp::PartialEq>::eq","status":"generated"},{"name":"<Mode as rustc_std_workspace_core::fmt::Debug>::fmt","status":"generated"},{"name":"<[u8] as CheckRaw>::char2raw_unit","status":"generated"},{"name":"<[u8] as Unescape>::char2unit","status":"generated"},{"name":"<[u8] as Unescape>::hex2unit","status":"generated"},{"name":"<[u8] as Unescape>::nonzero_byte2unit","status":"generated"},{"name":"<[u8] as Unescape>::unescape_1","status":"skipped","category":"missing_arbitrary","detail":"Missing Arbitrary implementation for argument(s) chars: &mut rustc_std_workspace_core::str::Chars<'_>","args":[{"name":"chars","type":"&mut rustc_std_workspace_core::str::Chars<'_>"}]},{"name":"<[u8] as Unescape>::unescape_single","status":"skipped","category":"missing_arbitrary","detail":"Missing Arbitrary implementation for argument(s) chars: &mut rustc_std_workspace_core::str::Chars<'_>","args":[{"name":"chars","type":"&mut rustc_std_workspace_core::str::Chars<'_>"}]},{"name":"<[u8] as Unescape>::unicode2unit","status":"generated"},{"name":"<rustc_std_workspace_core::ffi::CStr as CheckRaw>::char2raw_unit","status":"generated"},{"name":"<rustc_std_workspace_core::ffi::CStr as Unescape>::char2unit","status":"generated"},{"name":"<rustc_std_workspace_core::ffi::CStr as Unescape>::hex2unit","status":"generated"},{"name":"<rustc_std_workspace_core::ffi::CStr as Unescape>::nonzero_byte2unit","status":"generated"},{"name":"<rustc_std_workspace_core::ffi::CStr as Unescape>::unicode2unit","status":"generated"},{"name":"<str as CheckRaw>::char2raw_unit","status":"generated"},{"name":"<str as Unescape>::char2unit","status":"generated"},{"name":"<str as Unescape>::hex2unit","status":"generated"},{"name":"<str as Unescape>::nonzero_byte2unit","status":"generated"},{"name":"<str as Unescape>::unicode2unit","status":"generated"},{"name":"CheckRaw::check_raw","status":"skipped","category":"generic_no_candidate","detail":"Generic Function: no candidate type (i32, u32, usize, u8, i64, u64, f64, f32, bool, char and 13 types implementing the required traits) satisfies the function's trait bounds"},{"name":"EscapeError::is_fatal","status":"generated"},{"name":"Mode::in_double_quotes","status":"generated"},{"name":"Mode::prefix_noraw","status":"generated"},{"name":"Unescape::unescape","status":"skipped","category":"generic_no_candidate","detail":"Generic Function: no candidate type (i32, u32, usize, u8, i64, u64, f64, f32, bool, char and 13 types implementing the required traits) satisfies the function's trait bounds"},{"name":"char2byte","status":"generated"},{"name":"check_for_errors","status":"skipped","category":"generic_no_candidate","detail":"Generic Function: no candidate type (i32, u32, usize, u8, i64, u64, f64, f32, bool, char and 10 types implementing the required traits) satisfies the function's trait bounds"},{"name":"check_raw_byte_str","status":"skipped","category":"generic_no_candidate","detail":"Generic Function: no candidate type (i32, u32, usize, u8, i64, u64, f64, f32, bool, char and 10 types implementing the required traits) satisfies the function's trait bounds"},{"name":"check_raw_c_str","status":"skipped","category":"generic_no_candidate","detail":"Generic Function: no candidate type (i32, u32, usize, u8, i64, u64, f64, f32, bool, char and 10 types implementing the required traits) satisfies the function's trait bounds"},{"name":"check_raw_str","status":"skipped","category":"generic_no_candidate","detail":"Generic Function: no candidate type (i32, u32, usize, u8, i64, u64, f64, f32, bool, char and 10 types implementing the required traits) satisfies the function's trait bounds"},{"name":"hex_escape::<rustc_std_workspace_core::char::CaseMappingIter>","status":"generated"},{"name":"simple_escape","status":"generated"},{"name":"skip_ascii_whitespace","status":"skipped","category":"generic_no_candidate","detail":"Generic Function: no candidate type (i32, u32, usize, u8, i64, u64, f64, f32, bool, char and 10 types implementing the required traits) satisfies the function's trait bounds"},{"name":"unescape_byte","status":"skipped","category":"requires_bounded_arguments","detail":"Requires --bounded-arguments for argument(s) src: &str","args":[{"name":"src","type":"&str"}]},{"name":"unescape_byte_str","status":"skipped","category":"generic_no_candidate","detail":"Generic Function: no candidate type (i32, u32, usize, u8, i64, u64, f64, f32, bool, char and 10 types implementing the required traits) satisfies the function's trait bounds"},{"name":"unescape_c_str","status":"skipped","category":"generic_no_candidate","detail":"Generic Function: no candidate type (i32, u32, usize, u8, i64, u64, f64, f32, bool, char and 10 types implementing the required traits) satisfies the function's trait bounds"},{"name":"unescape_char","status":"skipped","category":"requires_bounded_arguments","detail":"Requires --bounded-arguments for argument(s) src: &str","args":[{"name":"src","type":"&str"}]},{"name":"unescape_str","status":"skipped","category":"generic_no_candidate","detail":"Generic Function: no candidate type (i32, u32, usize, u8, i64, u64, f64, f32, bool, char and 10 types implementing the required traits) satisfies the function's trait bounds"},{"name":"unicode_escape::<rustc_std_workspace_core::char::CaseMappingIter>","status":"generated"}]}
