{"schema_version":"1.0.0","run_id":"baseline-2026-09-17-x86_64","crate":"panic_unwind","functions":[{"name":"__rust_panic_cleanup","status":"generated"},{"name":"__rust_start_panic","status":"skipped","category":"missing_arbitrary","detail":"Missing Arbitrary implementation for argument(s) payload: &mut dyn rustc_std_workspace_core::panic::PanicPayload","args":[{"name":"payload","type":"&mut dyn rustc_std_workspace_core::panic::PanicPayload"}]},{"name":"imp::cleanup","status":"generated"},{"name":"imp::panic","status":"skipped","category":"missing_arbitrary","detail":"Missing Arbitrary implementation for argument(s) data: alloc::boxed::Box<dyn rustc_std_workspace_core::any::Any + rustc_std_workspace_core::marker::Send>","args":[{"name":"data","type":"alloc::boxed::Box<dyn rustc_std_workspace_core::any::Any + rustc_std_workspace_core::marker::Send>"}]},{"name":"imp::panic::exception_cleanup","status":"skipped","category":"missing_arbitrary","detail":"Missing Arbitrary implementation for argument(s) exception: *mut unwind::_Unwind_Exception","args":[{"name":"exception","type":"*mut unwind::_Unwind_Exception"}]}]}
