{"schema_version":"1.0.0","run_id":"baseline-2026-09-17-x86_64","crate":"std_detect","functions":[{"name":"<detect::arch::x86::Feature as rustc_std_workspace_core::clone::Clone>::clone","status":"generated"},{"name":"<detect::cache::Initializer as rustc_std_workspace_core::clone::Clone>::clone","status":"generated"},{"name":"<detect::cache::Initializer as rustc_std_workspace_core::cmp::Eq>::assert_fields_are_eq","status":"generated"},{"name":"<detect::cache::Initializer as rustc_std_workspace_core::cmp::PartialEq>::eq","status":"generated"},{"name":"<detect::cache::Initializer as rustc_std_workspace_core::default::Default>::default","status":"generated"},{"name":"detect::arch::x86::Feature::to_str","status":"generated"},{"name":"detect::arch::x86::__is_feature_detected::adx","status":"generated"},{"name":"detect::arch::x86::__is_feature_detected::aes","status":"generated"},{"name":"detect::arch::x86::__is_feature_detected::amx_avx512","status":"generated"},{"name":"detect::arch::x86::__is_feature_detected::amx_bf16","status":"generated"},{"name":"detect::arch::x86::__is_feature_detected::amx_complex","status":"generated"},{"name":"detect::arch::x86::__is_feature_detected::amx_fp16","status":"generated"},{"name":"detect::arch::x86::__is_feature_detected::amx_fp8","status":"generated"},{"name":"detect::arch::x86::__is_feature_detected::amx_int8","status":"generated"},{"name":"detect::arch::x86::__is_feature_detected::amx_movrs","status":"generated"},{"name":"detect::arch::x86::__is_feature_detected::amx_tile","status":"generated"},{"name":"detect::arch::x86::__is_feature_detected::apxf","status":"generated"},{"name":"detect::arch::x86::__is_feature_detected::avx","status":"generated"},{"name":"detect::arch::x86::__is_feature_detected::avx10_1","status":"generated"},{"name":"detect::arch::x86::__is_feature_detected::avx10_2","status":"generated"},{"name":"detect::arch::x86::__is_feature_detected::avx2","status":"generated"},{"name":"detect::arch::x86::__is_feature_detected::avx512bf16","status":"generated"},{"name":"detect::arch::x86::__is_feature_detected::avx512bitalg","status":"generated"},{"name":"detect::arch::x86::__is_feature_detected::avx512bw","status":"generated"},{"name":"detect::arch::x86::__is_feature_detected::avx512cd","status":"generated"},{"name":"detect::arch::x86::__is_feature_detected::avx512dq","status":"generated"},{"name":"detect::arch::x86::__is_feature_detected::avx512er","status":"generated"},{"name":"detect::arch::x86::__is_feature_detected::avx512f","status":"generated"},{"name":"detect::arch::x86::__is_feature_detected::avx512fp16","status":"generated"},{"name":"detect::arch::x86::__is_feature_detected::avx512ifma","status":"generated"},{"name":"detect::arch::x86::__is_feature_detected::avx512pf","status":"generated"},{"name":"detect::arch::x86::__is_feature_detected::avx512vbmi","status":"generated"},{"name":"detect::arch::x86::__is_feature_detected::avx512vbmi2","status":"generated"},{"name":"detect::arch::x86::__is_feature_detected::avx512vl","status":"generated"},{"name":"detect::arch::x86::__is_feature_detected::avx512vnni","status":"generated"},{"name":"detect::arch::x86::__is_feature_detected::avx512vp2intersect","status":"generated"},{"name":"detect::arch::x86::__is_feature_detected::avx512vpopcntdq","status":"generated"},{"name":"detect::arch::x86::__is_feature_detected::avxifma","status":"generated"},{"name":"detect::arch::x86::__is_feature_detected::avxneconvert","status":"generated"},{"name":"detect::arch::x86::__is_feature_detected::avxvnni","status":"generated"},{"name":"detect::arch::x86::__is_feature_detected::avxvnniint16","status":"generated"},{"name":"detect::arch::x86::__is_feature_detected::avxvnniint8","status":"generated"},{"name":"detect::arch::x86::__is_feature_detected::bmi1","status":"generated"},{"name":"detect::arch::x86::__is_feature_detected::bmi2","status":"generated"},{"name":"detect::arch::x86::__is_feature_detected::clflushopt","status":"generated"},{"name":"detect::arch::x86::__is_feature_detected::cmpxchg16b","status":"generated"},{"name":"detect::arch::x86::__is_feature_detected::ermsb","status":"generated"},{"name":"detect::arch::x86::__is_feature_detected::f16c","status":"generated"},{"name":"detect::arch::x86::__is_feature_detected::fma","status":"generated"},{"name":"detect::arch::x86::__is_feature_detected::fxsr","status":"generated"},{"name":"detect::arch::x86::__is_feature_detected::gfni","status":"generated"},{"name":"detect::arch::x86::__is_feature_detected::kl","status":"generated"},{"name":"detect::arch::x86::__is_feature_detected::lzcnt","status":"generated"},{"name":"detect::arch::x86::__is_feature_detected::mmx","status":"generated"},{"name":"detect::arch::x86::__is_feature_detected::movbe","status":"generated"},{"name":"detect::arch::x86::__is_feature_detected::movrs","status":"generated"},{"name":"detect::arch::x86::__is_feature_detected::pclmulqdq","status":"generated"},{"name":"detect::arch::x86::__is_feature_detected::popcnt","status":"generated"},{"name":"detect::arch::x86::__is_feature_detected::rdrand","status":"generated"},{"name":"detect::arch::x86::__is_feature_detected::rdseed","status":"generated"},{"name":"detect::arch::x86::__is_feature_detected::rtm","status":"generated"},{"name":"detect::arch::x86::__is_feature_detected::sha","status":"generated"},{"name":"detect::arch::x86::__is_feature_detected::sha512","status":"generated"},{"name":"detect::arch::x86::__is_feature_detected::sm3","status":"generated"},{"name":"detect::arch::x86::__is_feature_detected::sm4","status":"generated"},{"name":"detect::arch::x86::__is_feature_detected::sse","status":"generated"},{"name":"detect::arch::x86::__is_feature_detected::sse2","status":"generated"},{"name":"detect::arch::x86::__is_feature_detected::sse3","status":"generated"},{"name":"detect::arch::x86::__is_feature_detected::sse4_1","status":"generated"},{"name":"detect::arch::x86::__is_feature_detected::sse4_2","status":"generated"},{"name":"detect::arch::x86::__is_feature_detected::sse4a","status":"generated"},{"name":"detect::arch::x86::__is_feature_detected::ssse3","status":"generated"},{"name":"detect::arch::x86::__is_feature_detected::tbm","status":"generated"},{"name":"detect::arch::x86::__is_feature_detected::tsc","status":"generated"},{"name":"detect::arch::x86::__is_feature_detected::vaes","status":"generated"},{"name":"detect::arch::x86::__is_feature_detected::vpclmulqdq","status":"generated"},{"name":"detect::arch::x86::__is_feature_detected::widekl","status":"generated"},{"name":"detect::arch::x86::__is_feature_detected::xop","status":"generated"},{"name":"detect::arch::x86::__is_feature_detected::xsave","status":"generated"},{"name":"detect::arch::x86::__is_feature_detected::xsavec","status":"generated"},{"name":"detect::arch::x86::__is_feature_detected::xsaveopt","status":"generated"},{"name":"detect::arch::x86::__is_feature_detected::xsaves","status":"generated"},{"name":"detect::bit::test","status":"generated"},{"name":"detect::cache::Cache::initialize","status":"generated"},{"name":"detect::cache::Cache::test","status":"generated"},{"name":"detect::cache::Cache::uninitialized","status":"generated"},{"name":"detect::cache::Initializer::set","status":"generated"},{"name":"detect::cache::Initializer::test","status":"generated"},{"name":"detect::cache::Initializer::unset","status":"generated"},{"name":"detect::cache::detect_and_initialize","status":"generated"},{"name":"detect::cache::do_initialize","status":"generated"},{"name":"detect::cache::initialize","status":"generated"},{"name":"detect::cache::set_bit","status":"generated"},{"name":"detect::cache::test","status":"generated"},{"name":"detect::cache::test_bit","status":"generated"},{"name":"detect::cache::unset_bit","status":"generated"},{"name":"detect::check_for","status":"generated"},{"name":"detect::features","status":"generated"},{"name":"detect::os::detect_features","status":"generated"}]}
