{"schema_version":"1.0.0","run_id":"baseline-2026-09-17-x86_64","crate":"panic_abort","functions":[{"name":"__rust_panic_cleanup","status":"generated"},{"name":"__rust_start_panic","status":"skipped","category":"missing_arbitrary","detail":"Missing Arbitrary implementation for argument(s) _payload: &mut dyn rustc_std_workspace_core::panic::PanicPayload","args":[{"name":"_payload","type":"&mut dyn rustc_std_workspace_core::panic::PanicPayload"}]}]}
