{"schema_version":"1.0.0","run_id":"baseline-2026-09-17-x86_64","crate":"adler2","functions":[{"name":"<Adler32 as rustc_std_workspace_core::clone::Clone>::clone","status":"generated"},{"name":"<Adler32 as rustc_std_workspace_core::default::Default>::default","status":"generated"},{"name":"<Adler32 as rustc_std_workspace_core::fmt::Debug>::fmt","status":"generated"},{"name":"<Adler32 as rustc_std_workspace_core::hash::Hasher>::finish","status":"generated"},{"name":"<Adler32 as rustc_std_workspace_core::hash::Hasher>::write","status":"skipped","category":"requires_bounded_arguments","detail":"Requires --bounded-arguments for argument(s) bytes: &[u8]","args":[{"name":"bytes","type":"&[u8]"}]},{"name":"<algo::U32X4 as rustc_std_workspace_core::clone::Clone>::clone","status":"generated"},{"name":"<algo::U32X4 as rustc_std_workspace_core::ops::AddAssign>::add_assign","status":"generated"},{"name":"<algo::U32X4 as rustc_std_workspace_core::ops::MulAssign<u32>>::mul_assign","status":"generated"},{"name":"<algo::U32X4 as rustc_std_workspace_core::ops::RemAssign<u32>>::rem_assign","status":"generated"},{"name":"Adler32::checksum","status":"generated"},{"name":"Adler32::from_checksum","status":"generated"},{"name":"Adler32::new","status":"generated"},{"name":"Adler32::write_slice","status":"skipped","category":"requires_bounded_arguments","detail":"Requires --bounded-arguments for argument(s) bytes: &[u8]","args":[{"name":"bytes","type":"&[u8]"}]},{"name":"adler32_slice","status":"skipped","category":"requires_bounded_arguments","detail":"Requires --bounded-arguments for argument(s) data: &[u8]","args":[{"name":"data","type":"&[u8]"}]},{"name":"algo::<impl Adler32>::compute","status":"skipped","category":"requires_bounded_arguments","detail":"Requires --bounded-arguments for argument(s) bytes: &[u8]","args":[{"name":"bytes","type":"&[u8]"}]},{"name":"algo::U32X4::from","status":"skipped","category":"requires_bounded_arguments","detail":"Requires --bounded-arguments for argument(s) bytes: &[u8]","args":[{"name":"bytes","type":"&[u8]"}]}]}
