{"schema_version":"1.0.0","run_id":"baseline-2026-09-17-x86_64","crate":"unwind","functions":[{"name":"<types::_Unwind_Reason_Code as rustc_std_workspace_core::clone::Clone>::clone","status":"generated"},{"name":"<types::_Unwind_Reason_Code as rustc_std_workspace_core::cmp::PartialEq>::eq","status":"generated"},{"name":"<types::_Unwind_Reason_Code as rustc_std_workspace_core::fmt::Debug>::fmt","status":"generated"}]}
